{
  "agents": [
    {
      "agent_id": "agent:district-0000",
      "building_id": "building:home-a",
      "journey_id": null,
      "movement_state": "stationary",
      "place_id": "place:home-a",
      "position_authority": "authoritative",
      "room_id": "room:home-a",
      "route_node_id": "1001"
    },
    {
      "agent_id": "agent:district-0001",
      "building_id": "building:home-b",
      "journey_id": null,
      "movement_state": "stationary",
      "place_id": "place:home-b",
      "position_authority": "authoritative",
      "room_id": "room:home-b",
      "route_node_id": "1002"
    },
    {
      "agent_id": "agent:district-0002",
      "building_id": "building:home-a",
      "journey_id": null,
      "movement_state": "stationary",
      "place_id": "place:home-a",
      "position_authority": "authoritative",
      "room_id": "room:home-a",
      "route_node_id": "1001"
    },
    {
      "agent_id": "agent:district-0003",
      "building_id": "building:home-b",
      "journey_id": null,
      "movement_state": "stationary",
      "place_id": "place:home-b",
      "position_authority": "authoritative",
      "room_id": "room:home-b",
      "route_node_id": "1002"
    },
    {
      "agent_id": "agent:district-0004",
      "building_id": "building:home-a",
      "journey_id": null,
      "movement_state": "stationary",
      "place_id": "place:home-a",
      "position_authority": "authoritative",
      "room_id": "room:home-a",
      "route_node_id": "1001"
    },
    {
      "agent_id": "agent:district-0005",
      "building_id": "building:home-b",
      "journey_id": null,
      "movement_state": "stationary",
      "place_id": "place:home-b",
      "position_authority": "authoritative",
      "room_id": "room:home-b",
      "route_node_id": "1002"
    },
    {
      "agent_id": "agent:district-0006",
      "building_id": "building:home-a",
      "journey_id": null,
      "movement_state": "stationary",
      "place_id": "place:home-a",
      "position_authority": "authoritative",
      "room_id": "room:home-a",
      "route_node_id": "1001"
    },
    {
      "agent_id": "agent:district-0007",
      "building_id": "building:home-b",
      "journey_id": null,
      "movement_state": "stationary",
      "place_id": "place:home-b",
      "position_authority": "authoritative",
      "room_id": "room:home-b",
      "route_node_id": "1002"
    },
    {
      "agent_id": "agent:district-0008",
      "building_id": "building:home-a",
      "journey_id": null,
      "movement_state": "stationary",
      "place_id": "place:home-a",
      "position_authority": "authoritative",
      "room_id": "room:home-a",
      "route_node_id": "1001"
    },
    {
      "agent_id": "agent:district-0009",
      "building_id": "building:home-b",
      "journey_id": null,
      "movement_state": "stationary",
      "place_id": "place:home-b",
      "position_authority": "authoritative",
      "room_id": "room:home-b",
      "route_node_id": "1002"
    },
    {
      "agent_id": "agent:district-0010",
      "building_id": "building:home-a",
      "journey_id": null,
      "movement_state": "stationary",
      "place_id": "place:home-a",
      "position_authority": "authoritative",
      "room_id": "room:home-a",
      "route_node_id": "1001"
    },
    {
      "agent_id": "agent:district-0011",
      "building_id": "building:home-b",
      "journey_id": null,
      "movement_state": "stationary",
      "place_id": "place:home-b",
      "position_authority": "authoritative",
      "room_id": "room:home-b",
      "route_node_id": "1002"
    },
    {
      "agent_id": "agent:district-0012",
      "building_id": "building:home-a",
      "journey_id": null,
      "movement_state": "stationary",
      "place_id": "place:home-a",
      "position_authority": "authoritative",
      "room_id": "room:home-a",
      "route_node_id": "1001"
    },
    {
      "agent_id": "agent:district-0013",
      "building_id": "building:home-b",
      "journey_id": null,
      "movement_state": "stationary",
      "place_id": "place:home-b",
      "position_authority": "authoritative",
      "room_id": "room:home-b",
      "route_node_id": "1002"
    },
    {
      "agent_id": "agent:district-0014",
      "building_id": "building:home-a",
      "journey_id": null,
      "movement_state": "stationary",
      "place_id": "place:home-a",
      "position_authority": "authoritative",
      "room_id": "room:home-a",
      "route_node_id": "1001"
    },
    {
      "agent_id": "agent:district-0015",
      "building_id": "building:home-b",
      "journey_id": null,
      "movement_state": "stationary",
      "place_id": "place:home-b",
      "position_authority": "authoritative",
      "room_id": "room:home-b",
      "route_node_id": "1002"
    },
    {
      "agent_id": "agent:district-0016",
      "building_id": "building:home-a",
      "journey_id": null,
      "movement_state": "stationary",
      "place_id": "place:home-a",
      "position_authority": "authoritative",
      "room_id": "room:home-a",
      "route_node_id": "1001"
    },
    {
      "agent_id": "agent:district-0017",
      "building_id": "building:home-b",
      "journey_id": null,
      "movement_state": "stationary",
      "place_id": "place:home-b",
      "position_authority": "authoritative",
      "room_id": "room:home-b",
      "route_node_id": "1002"
    },
    {
      "agent_id": "agent:district-0018",
      "building_id": "building:home-a",
      "journey_id": null,
      "movement_state": "stationary",
      "place_id": "place:home-a",
      "position_authority": "authoritative",
      "room_id": "room:home-a",
      "route_node_id": "1001"
    },
    {
      "agent_id": "agent:district-0019",
      "building_id": "building:home-b",
      "journey_id": null,
      "movement_state": "stationary",
      "place_id": "place:home-b",
      "position_authority": "authoritative",
      "room_id": "room:home-b",
      "route_node_id": "1002"
    },
    {
      "agent_id": "agent:district-0020",
      "building_id": "building:home-a",
      "journey_id": null,
      "movement_state": "stationary",
      "place_id": "place:home-a",
      "position_authority": "authoritative",
      "room_id": "room:home-a",
      "route_node_id": "1001"
    },
    {
      "agent_id": "agent:district-0021",
      "building_id": "building:home-b",
      "journey_id": null,
      "movement_state": "stationary",
      "place_id": "place:home-b",
      "position_authority": "authoritative",
      "room_id": "room:home-b",
      "route_node_id": "1002"
    },
    {
      "agent_id": "agent:district-0022",
      "building_id": "building:home-a",
      "journey_id": null,
      "movement_state": "stationary",
      "place_id": "place:home-a",
      "position_authority": "authoritative",
      "room_id": "room:home-a",
      "route_node_id": "1001"
    },
    {
      "agent_id": "agent:district-0023",
      "building_id": "building:home-b",
      "journey_id": null,
      "movement_state": "stationary",
      "place_id": "place:home-b",
      "position_authority": "authoritative",
      "room_id": "room:home-b",
      "route_node_id": "1002"
    },
    {
      "agent_id": "agent:district-0024",
      "building_id": "building:home-a",
      "journey_id": null,
      "movement_state": "stationary",
      "place_id": "place:home-a",
      "position_authority": "authoritative",
      "room_id": "room:home-a",
      "route_node_id": "1001"
    },
    {
      "agent_id": "agent:district-0025",
      "building_id": "building:home-b",
      "journey_id": null,
      "movement_state": "stationary",
      "place_id": "place:home-b",
      "position_authority": "authoritative",
      "room_id": "room:home-b",
      "route_node_id": "1002"
    },
    {
      "agent_id": "agent:district-0026",
      "building_id": "building:home-a",
      "journey_id": null,
      "movement_state": "stationary",
      "place_id": "place:home-a",
      "position_authority": "authoritative",
      "room_id": "room:home-a",
      "route_node_id": "1001"
    },
    {
      "agent_id": "agent:district-0027",
      "building_id": "building:home-b",
      "journey_id": null,
      "movement_state": "stationary",
      "place_id": "place:home-b",
      "position_authority": "authoritative",
      "room_id": "room:home-b",
      "route_node_id": "1002"
    },
    {
      "agent_id": "agent:district-0028",
      "building_id": "building:home-a",
      "journey_id": null,
      "movement_state": "stationary",
      "place_id": "place:home-a",
      "position_authority": "authoritative",
      "room_id": "room:home-a",
      "route_node_id": "1001"
    },
    {
      "agent_id": "agent:district-0029",
      "building_id": "building:home-b",
      "journey_id": null,
      "movement_state": "stationary",
      "place_id": "place:home-b",
      "position_authority": "authoritative",
      "room_id": "room:home-b",
      "route_node_id": "1002"
    },
    {
      "agent_id": "agent:district-0030",
      "building_id": "building:home-a",
      "journey_id": null,
      "movement_state": "stationary",
      "place_id": "place:home-a",
      "position_authority": "authoritative",
      "room_id": "room:home-a",
      "route_node_id": "1001"
    },
    {
      "agent_id": "agent:district-0031",
      "building_id": "building:home-b",
      "journey_id": null,
      "movement_state": "stationary",
      "place_id": "place:home-b",
      "position_authority": "authoritative",
      "room_id": "room:home-b",
      "route_node_id": "1002"
    },
    {
      "agent_id": "agent:district-0032",
      "building_id": "building:home-a",
      "journey_id": null,
      "movement_state": "stationary",
      "place_id": "place:home-a",
      "position_authority": "authoritative",
      "room_id": "room:home-a",
      "route_node_id": "1001"
    },
    {
      "agent_id": "agent:district-0033",
      "building_id": "building:home-b",
      "journey_id": null,